{
  "extensions": {
    "x-analysis": {
      "contract": "horn-analysis/0.1",
      "description": "Semantic response topology; relation routes are intentionally abstracted.",
      "edges": [
        {
          "from": "c2-imitation-game",
          "id": "r-c2-c1",
          "kind": "supports",
          "label": "supported by",
          "to": "c1-machines-can-think"
        },
        {
          "from": "c3-substrate-independent",
          "id": "r-c3-c1",
          "kind": "supports",
          "label": "supported by",
          "to": "c1-machines-can-think"
        },
        {
          "from": "g1-universal-machine",
          "id": "r-g1-c2",
          "kind": "supports",
          "label": "supported by",
          "to": "c2-imitation-game"
        },
        {
          "from": "w1-behavior-sufficient",
          "id": "r-w1-c1",
          "kind": "warrants",
          "label": "warrant",
          "to": "c1-machines-can-think"
        },
        {
          "from": "c5-chinese-room",
          "id": "r-c5-g2",
          "kind": "supports",
          "label": "supported by",
          "to": "g2-man-is-the-program"
        },
        {
          "from": "g2-man-is-the-program",
          "id": "r-g2-c4",
          "kind": "supports",
          "label": "supported by",
          "to": "c4-syntax-not-semantics"
        },
        {
          "from": "c4-syntax-not-semantics",
          "id": "r-c4-c6",
          "kind": "supports",
          "label": "supported by",
          "to": "c6-simulate-not-think"
        },
        {
          "from": "c6-simulate-not-think",
          "id": "r-c6-c1",
          "kind": "disputes",
          "label": "disputed by",
          "to": "c1-machines-can-think"
        },
        {
          "from": "c7-systems-reply",
          "id": "r-c7-c4",
          "kind": "disputes",
          "label": "disputed by",
          "to": "c4-syntax-not-semantics"
        },
        {
          "from": "c8-internalization",
          "id": "r-c8-c7",
          "kind": "disputes",
          "label": "disputed by",
          "to": "c7-systems-reply"
        }
      ],
      "placed": [
        {
          "center": {
            "x": 1300,
            "y": 414
          },
          "focus": true,
          "id": "c1-machines-can-think",
          "kind": "claim",
          "label": "Machines can think",
          "number": 1
        },
        {
          "center": {
            "x": 430,
            "y": 393
          },
          "focus": false,
          "id": "c2-imitation-game",
          "kind": "claim",
          "label": "The imitation game",
          "number": 2
        },
        {
          "center": {
            "x": 430,
            "y": 661
          },
          "focus": false,
          "id": "c3-substrate-independent",
          "kind": "claim",
          "label": "Substrate independence",
          "number": 3
        },
        {
          "center": {
            "x": 430,
            "y": 919
          },
          "focus": false,
          "id": "g1-universal-machine",
          "kind": "grounds",
          "label": "Universal discrete-state machine",
          "number": 4
        },
        {
          "center": {
            "x": 430,
            "y": 1187
          },
          "focus": false,
          "id": "w1-behavior-sufficient",
          "kind": "warrant",
          "label": "Behavioral warrant",
          "number": 5
        },
        {
          "center": {
            "x": 2170,
            "y": 403
          },
          "focus": false,
          "id": "c5-chinese-room",
          "kind": "example",
          "label": "The Chinese Room",
          "number": 6
        },
        {
          "center": {
            "x": 2170,
            "y": 671
          },
          "focus": false,
          "id": "g2-man-is-the-program",
          "kind": "grounds",
          "label": "The man implements the program",
          "number": 7
        },
        {
          "center": {
            "x": 2170,
            "y": 929
          },
          "focus": false,
          "id": "c4-syntax-not-semantics",
          "kind": "claim",
          "label": "Syntax is not semantics",
          "number": 8
        },
        {
          "center": {
            "x": 2170,
            "y": 1207
          },
          "focus": false,
          "id": "c6-simulate-not-think",
          "kind": "claim",
          "label": "Simulation is not thought",
          "number": 9
        },
        {
          "center": {
            "x": 1300,
            "y": 757
          },
          "focus": false,
          "id": "c7-systems-reply",
          "kind": "rebuttal",
          "label": "The systems reply",
          "number": 10
        },
        {
          "center": {
            "x": 1300,
            "y": 1035
          },
          "focus": false,
          "id": "c8-internalization",
          "kind": "rebuttal",
          "label": "Internalization",
          "number": 11
        },
        {
          "center": {
            "x": 1300,
            "y": 1325
          },
          "focus": false,
          "id": "a1-stable-argumentation",
          "kind": "gloss",
          "label": "Relatively stable argumentation",
          "number": 12
        }
      ],
      "runtime": "horn-runtime/0.1",
      "title": "Argument",
      "view": "argument"
    }
  },
  "id": "horn:authored:2026:chinese-room:argument",
  "nodes": [
    "c1-machines-can-think",
    "c2-imitation-game",
    "c3-substrate-independent",
    "g1-universal-machine",
    "w1-behavior-sufficient",
    "c5-chinese-room",
    "g2-man-is-the-program",
    "c4-syntax-not-semantics",
    "c6-simulate-not-think",
    "c7-systems-reply",
    "c8-internalization",
    "a1-stable-argumentation"
  ],
  "relations": [
    "r-c2-c1",
    "r-c3-c1",
    "r-g1-c2",
    "r-w1-c1",
    "r-c5-g2",
    "r-g2-c4",
    "r-c4-c6",
    "r-c6-c1",
    "r-c7-c4",
    "r-c8-c7"
  ],
  "source": {
    "documentId": "horn:authored:2026:chinese-room",
    "documentVersion": "horn-document/0.1"
  },
  "target": "argument",
  "version": "horn-projection/0.1"
}
