{
  "extensions": {
    "x-analysis": {
      "bindings": [
        {
          "citationId": "turing-1950",
          "id": "evidence:turing-1950:c1-machines-can-think",
          "nodeId": "c1-machines-can-think"
        },
        {
          "citationId": "horn-cct-cartographic",
          "id": "evidence:horn-cct-cartographic:c1-machines-can-think",
          "nodeId": "c1-machines-can-think"
        },
        {
          "citationId": "turing-1950",
          "id": "evidence:turing-1950:c2-imitation-game",
          "nodeId": "c2-imitation-game"
        },
        {
          "citationId": "turing-1950",
          "id": "evidence:turing-1950:c3-substrate-independent",
          "nodeId": "c3-substrate-independent"
        },
        {
          "citationId": "turing-1950",
          "id": "evidence:turing-1950:g1-universal-machine",
          "nodeId": "g1-universal-machine"
        },
        {
          "citationId": "turing-1950",
          "id": "evidence:turing-1950:w1-behavior-sufficient",
          "nodeId": "w1-behavior-sufficient"
        },
        {
          "citationId": "searle-1980",
          "id": "evidence:searle-1980:c5-chinese-room",
          "nodeId": "c5-chinese-room"
        },
        {
          "citationId": "searle-1980",
          "id": "evidence:searle-1980:g2-man-is-the-program",
          "nodeId": "g2-man-is-the-program"
        },
        {
          "citationId": "searle-1980",
          "id": "evidence:searle-1980:c4-syntax-not-semantics",
          "nodeId": "c4-syntax-not-semantics"
        },
        {
          "citationId": "searle-1980",
          "id": "evidence:searle-1980:c6-simulate-not-think",
          "nodeId": "c6-simulate-not-think"
        },
        {
          "citationId": "searle-1980",
          "id": "evidence:searle-1980:c7-systems-reply",
          "nodeId": "c7-systems-reply"
        },
        {
          "citationId": "searle-1980",
          "id": "evidence:searle-1980:c8-internalization",
          "nodeId": "c8-internalization"
        },
        {
          "citationId": "horn-cct-cartographic",
          "id": "evidence:horn-cct-cartographic:a1-stable-argumentation",
          "nodeId": "a1-stable-argumentation"
        },
        {
          "citationId": "yoshimi-2004",
          "id": "evidence:yoshimi-2004:a1-stable-argumentation",
          "nodeId": "a1-stable-argumentation"
        }
      ],
      "citations": [
        {
          "id": "turing-1950",
          "layer": "mapped",
          "short": "Turing 1950",
          "year": 1950
        },
        {
          "id": "horn-cct-cartographic",
          "layer": "cartographic",
          "short": "Horn 1998 (after)",
          "year": 1998
        },
        {
          "id": "searle-1980",
          "layer": "mapped",
          "short": "Searle 1980",
          "year": 1980
        },
        {
          "id": "yoshimi-2004",
          "layer": "cartographic",
          "short": "Yoshimi 2004",
          "year": 2004
        }
      ],
      "claims": [
        {
          "citationIds": [
            "turing-1950",
            "horn-cct-cartographic"
          ],
          "focus": true,
          "id": "c1-machines-can-think",
          "label": "Machines can think",
          "number": 1
        },
        {
          "citationIds": [
            "turing-1950"
          ],
          "focus": false,
          "id": "c2-imitation-game",
          "label": "The imitation game",
          "number": 2
        },
        {
          "citationIds": [
            "turing-1950"
          ],
          "focus": false,
          "id": "c3-substrate-independent",
          "label": "Substrate independence",
          "number": 3
        },
        {
          "citationIds": [
            "turing-1950"
          ],
          "focus": false,
          "id": "g1-universal-machine",
          "label": "Universal discrete-state machine",
          "number": 4
        },
        {
          "citationIds": [
            "turing-1950"
          ],
          "focus": false,
          "id": "w1-behavior-sufficient",
          "label": "Behavioral warrant",
          "number": 5
        },
        {
          "citationIds": [
            "searle-1980"
          ],
          "focus": false,
          "id": "c5-chinese-room",
          "label": "The Chinese Room",
          "number": 6
        },
        {
          "citationIds": [
            "searle-1980"
          ],
          "focus": false,
          "id": "g2-man-is-the-program",
          "label": "The man implements the program",
          "number": 7
        },
        {
          "citationIds": [
            "searle-1980"
          ],
          "focus": false,
          "id": "c4-syntax-not-semantics",
          "label": "Syntax is not semantics",
          "number": 8
        },
        {
          "citationIds": [
            "searle-1980"
          ],
          "focus": false,
          "id": "c6-simulate-not-think",
          "label": "Simulation is not thought",
          "number": 9
        },
        {
          "citationIds": [
            "searle-1980"
          ],
          "focus": false,
          "id": "c7-systems-reply",
          "label": "The systems reply",
          "number": 10
        },
        {
          "citationIds": [
            "searle-1980"
          ],
          "focus": false,
          "id": "c8-internalization",
          "label": "Internalization",
          "number": 11
        },
        {
          "citationIds": [
            "horn-cct-cartographic",
            "yoshimi-2004"
          ],
          "focus": false,
          "id": "a1-stable-argumentation",
          "label": "Relatively stable argumentation",
          "number": 12
        }
      ],
      "contract": "horn-analysis/0.1",
      "description": "Derived source-to-claim network across mapped and cartographic provenance layers.",
      "runtime": "horn-runtime/0.1",
      "title": "Evidence",
      "view": "evidence"
    }
  },
  "id": "horn:authored:2026:chinese-room:evidence",
  "nodes": [
    "c1-machines-can-think",
    "c2-imitation-game",
    "c3-substrate-independent",
    "g1-universal-machine",
    "w1-behavior-sufficient",
    "c5-chinese-room",
    "g2-man-is-the-program",
    "c4-syntax-not-semantics",
    "c6-simulate-not-think",
    "c7-systems-reply",
    "c8-internalization",
    "a1-stable-argumentation"
  ],
  "relations": [],
  "source": {
    "documentId": "horn:authored:2026:chinese-room",
    "documentVersion": "horn-document/0.1"
  },
  "target": "evidence",
  "version": "horn-projection/0.1"
}
